{
  "kind": "asset",
  "schemaVersion": "1.0.0",
  "id": "enemy-mob-32-moonlace-hind",
  "name": "Moonlace Hind",
  "category": {
    "id": "enemy-mob-32",
    "version": "0.1.0"
  },
  "style": {
    "id": "assembler-inspired-v2",
    "version": "0.1.0"
  },
  "createdAt": "2026-08-01T11:20:46.737Z",
  "tags": [
    "moonlace",
    "hind",
    "antigravity",
    "enemy-mob-32"
  ]
}
