{
  "kind": "asset",
  "schemaVersion": "1.0.0",
  "id": "enemy-mob-32-boglace-frog",
  "name": "Boglace Frog",
  "category": {
    "id": "enemy-mob-32",
    "version": "0.1.0"
  },
  "style": {
    "id": "assembler-inspired-v2",
    "version": "0.1.0"
  },
  "createdAt": "2026-08-01T21:56:02.134Z",
  "tags": [
    "boglace",
    "frog",
    "antigravity",
    "enemy-mob-32"
  ]
}
