{
  "kind": "asset",
  "schemaVersion": "1.0.0",
  "id": "enemy-mob-32-brasswing-drone",
  "name": "Brasswing Drone",
  "category": {
    "id": "enemy-mob-32",
    "version": "0.1.0"
  },
  "style": {
    "id": "assembler-inspired-v2",
    "version": "0.1.0"
  },
  "createdAt": "2026-08-01T01:46:12.188Z",
  "tags": [
    "brasswing",
    "drone",
    "antigravity",
    "enemy-mob-32"
  ]
}
