{
  "kind": "asset",
  "schemaVersion": "1.0.0",
  "id": "enemy-mob-32-furnace-scarab",
  "name": "Furnace Scarab",
  "category": {
    "id": "enemy-mob-32",
    "version": "0.1.0"
  },
  "style": {
    "id": "assembler-inspired-v2",
    "version": "0.1.0"
  },
  "createdAt": "2026-08-01T23:34:35.000Z",
  "tags": [
    "furnace",
    "scarab",
    "antigravity",
    "enemy-mob-32"
  ]
}
