{
  "kind": "asset",
  "schemaVersion": "1.0.0",
  "id": "enemy-mob-32-tollgate-clubber",
  "name": "Tollgate Clubber",
  "category": {
    "id": "enemy-mob-32",
    "version": "0.1.0"
  },
  "style": {
    "id": "assembler-inspired-v2",
    "version": "0.1.0"
  },
  "createdAt": "2026-08-02T16:51:30.000Z",
  "tags": [
    "tollgate",
    "clubber",
    "antigravity",
    "enemy-mob-32"
  ]
}
