{
  "kind": "asset",
  "schemaVersion": "1.0.0",
  "id": "enemy-mob-32-kennel-sergeant",
  "name": "Kennel Sergeant",
  "category": {
    "id": "enemy-mob-32",
    "version": "0.1.0"
  },
  "style": {
    "id": "assembler-inspired-v2",
    "version": "0.1.0"
  },
  "createdAt": "2026-08-02T01:26:34.330Z",
  "tags": [
    "kennel",
    "sergeant",
    "antigravity",
    "enemy-mob-32"
  ]
}
