{
  "kind": "asset",
  "schemaVersion": "1.0.0",
  "id": "enemy-mob-32-brimstone-hound",
  "name": "Brimstone Hound",
  "category": {
    "id": "enemy-mob-32",
    "version": "0.1.0"
  },
  "style": {
    "id": "assembler-inspired-v2",
    "version": "0.1.0"
  },
  "createdAt": "2026-08-02T03:35:10.000Z",
  "tags": [
    "brimstone",
    "hound",
    "antigravity",
    "enemy-mob-32"
  ]
}
