{
  "kind": "asset",
  "schemaVersion": "1.0.0",
  "id": "enemy-mob-32-runehand-adept",
  "name": "Runehand Adept",
  "category": {
    "id": "enemy-mob-32",
    "version": "0.1.0"
  },
  "style": {
    "id": "assembler-inspired-v2",
    "version": "0.1.0"
  },
  "createdAt": "2026-08-02T23:30:10.000Z",
  "tags": [
    "runehand",
    "adept",
    "antigravity",
    "enemy-mob-32"
  ]
}
