{
  "kind": "asset",
  "schemaVersion": "1.0.0",
  "id": "enemy-mob-32-avalanche-trollkin",
  "name": "Avalanche Trollkin",
  "category": {
    "id": "enemy-mob-32",
    "version": "0.1.0"
  },
  "style": {
    "id": "assembler-inspired-v2",
    "version": "0.1.0"
  },
  "createdAt": "2026-08-01T01:29:00.000Z",
  "tags": [
    "avalanche",
    "trollkin",
    "antigravity",
    "enemy-mob-32"
  ]
}
