{
  "kind": "asset",
  "schemaVersion": "1.0.0",
  "id": "enemy-mob-32-furnace-cherub",
  "name": "Furnace Cherub",
  "category": {
    "id": "enemy-mob-32",
    "version": "0.1.0"
  },
  "style": {
    "id": "assembler-inspired-v2",
    "version": "0.1.0"
  },
  "createdAt": "2026-08-02T01:43:29.543Z",
  "tags": [
    "furnace",
    "cherub",
    "antigravity",
    "enemy-mob-32"
  ]
}
