{
  "kind": "asset",
  "schemaVersion": "1.0.0",
  "id": "enemy-mob-32-prismhorn-ram",
  "name": "Prismhorn Ram",
  "category": {
    "id": "enemy-mob-32",
    "version": "0.1.0"
  },
  "style": {
    "id": "assembler-inspired-v2",
    "version": "0.1.0"
  },
  "createdAt": "2026-08-02T01:22:40.000Z",
  "tags": [
    "prismhorn",
    "ram",
    "antigravity",
    "enemy-mob-32"
  ]
}
