{
  "kind": "asset",
  "schemaVersion": "1.0.0",
  "id": "enemy-mob-32-caltrop-slinger",
  "name": "Caltrop Slinger",
  "category": {
    "id": "enemy-mob-32",
    "version": "0.1.0"
  },
  "style": {
    "id": "assembler-inspired-v2",
    "version": "0.1.0"
  },
  "createdAt": "2026-08-02T00:29:40.000Z",
  "tags": [
    "caltrop",
    "slinger",
    "antigravity",
    "enemy-mob-32"
  ]
}
