{
  "kind": "asset",
  "schemaVersion": "1.0.0",
  "id": "enemy-mob-32-obsidian-skitter",
  "name": "Obsidian Skitter",
  "category": {
    "id": "enemy-mob-32",
    "version": "0.1.0"
  },
  "style": {
    "id": "assembler-inspired-v2",
    "version": "0.1.0"
  },
  "createdAt": "2026-08-01T01:55:00.000Z",
  "tags": [
    "obsidian",
    "skitter",
    "antigravity",
    "enemy-mob-32"
  ]
}
