{
  "kind": "asset",
  "schemaVersion": "1.0.0",
  "id": "enemy-mob-32-whistle-scout",
  "name": "Whistle Scout",
  "category": {
    "id": "enemy-mob-32",
    "version": "0.1.0"
  },
  "style": {
    "id": "assembler-inspired-v2",
    "version": "0.1.0"
  },
  "createdAt": "2026-08-01T23:17:37.470Z",
  "tags": [
    "whistle",
    "scout",
    "antigravity",
    "enemy-mob-32"
  ]
}
