{
  "kind": "asset",
  "schemaVersion": "1.0.0",
  "id": "enemy-mob-32-roadhook-brute",
  "name": "Roadhook Brute",
  "category": {
    "id": "enemy-mob-32",
    "version": "0.1.0"
  },
  "style": {
    "id": "assembler-inspired-v2",
    "version": "0.1.0"
  },
  "createdAt": "2026-08-01T22:32:23.664Z",
  "tags": [
    "roadhook",
    "brute",
    "antigravity",
    "enemy-mob-32"
  ]
}
