{
  "kind": "asset",
  "schemaVersion": "1.0.0",
  "id": "enemy-mob-32-brookwater-elemental",
  "name": "Brookwater Elemental",
  "category": {
    "id": "enemy-mob-32",
    "version": "0.1.0"
  },
  "style": {
    "id": "assembler-inspired-v2",
    "version": "0.1.0"
  },
  "createdAt": "2026-08-02T19:42:48.182Z",
  "tags": [
    "brookwater",
    "elemental",
    "antigravity",
    "enemy-mob-32"
  ]
}
