{
  "kind": "asset",
  "schemaVersion": "1.0.0",
  "id": "enemy-mob-32-squallwing-bat",
  "name": "Squallwing Bat",
  "category": {
    "id": "enemy-mob-32",
    "version": "0.1.0"
  },
  "style": {
    "id": "assembler-inspired-v2",
    "version": "0.1.0"
  },
  "createdAt": "2026-08-03T00:25:38.000Z",
  "tags": [
    "squallwing",
    "bat",
    "antigravity",
    "enemy-mob-32"
  ]
}
