{
  "kind": "asset",
  "schemaVersion": "1.0.0",
  "id": "enemy-mob-32-graveyard-archer",
  "name": "Graveyard Archer",
  "category": {
    "id": "enemy-mob-32",
    "version": "0.1.0"
  },
  "style": {
    "id": "assembler-inspired-v2",
    "version": "0.1.0"
  },
  "createdAt": "2026-08-02T15:04:49.830Z",
  "tags": [
    "graveyard",
    "archer",
    "antigravity",
    "enemy-mob-32"
  ]
}
