{
  "kind": "asset",
  "schemaVersion": "1.0.0",
  "id": "enemy-mob-32-barrow-ferryman",
  "name": "Barrow Ferryman",
  "category": {
    "id": "enemy-mob-32",
    "version": "0.1.0"
  },
  "style": {
    "id": "assembler-inspired-v2",
    "version": "0.1.0"
  },
  "createdAt": "2026-08-01T10:53:10.365Z",
  "tags": [
    "barrow",
    "ferryman",
    "antigravity",
    "enemy-mob-32"
  ]
}
