{
  "kind": "asset",
  "schemaVersion": "1.0.0",
  "id": "enemy-mob-32-crossbow-sentry",
  "name": "Crossbow Sentry",
  "category": {
    "id": "enemy-mob-32",
    "version": "0.1.0"
  },
  "style": {
    "id": "assembler-inspired-v2",
    "version": "0.1.0"
  },
  "createdAt": "2026-08-01T11:06:55.000Z",
  "tags": [
    "crossbow",
    "sentry",
    "antigravity",
    "enemy-mob-32"
  ]
}
