{
  "kind": "asset",
  "schemaVersion": "1.0.0",
  "id": "enemy-mob-32-bonecrack-scavenger",
  "name": "Bonecrack Scavenger",
  "category": {
    "id": "enemy-mob-32",
    "version": "0.1.0"
  },
  "style": {
    "id": "assembler-inspired-v2",
    "version": "0.1.0"
  },
  "createdAt": "2026-08-02T16:40:40.000Z",
  "tags": [
    "bonecrack",
    "scavenger",
    "antigravity",
    "enemy-mob-32"
  ]
}
