{
  "kind": "asset",
  "schemaVersion": "1.0.0",
  "id": "enemy-mob-32-needleleg-weaver",
  "name": "Needleleg Weaver",
  "category": {
    "id": "enemy-mob-32",
    "version": "0.1.0"
  },
  "style": {
    "id": "assembler-inspired-v2",
    "version": "0.1.0"
  },
  "createdAt": "2026-08-02T15:17:40.000Z",
  "tags": [
    "needleleg",
    "weaver",
    "antigravity",
    "enemy-mob-32"
  ]
}
